{"schema_version":"1.2.0","asOf":"2026-10-04","sources":[{"id":"edu-newschool","label":"지방교육재정알리미 신설예정학교","publisher":"교육부·한국교육학술정보원","url":"https://eduinfo.go.kr/portal/theme/newSchMapPage.do","redistributable":"unknown","asOf":"2026-03-31"},{"id":"vworld-upis","label":"V-World 도시계획시설(UPIS)","publisher":"국토교통부","url":"https://www.vworld.kr","redistributable":"unknown","asOf":"2026-10-04"},{"id":"edu-zone","label":"한국교육시설안전원 초등학교통학구역·학교학구도연계정보·초중등학교위치","publisher":"한국교육시설안전원","url":"https://www.data.go.kr/data/15159265/fileData.do","license":"이용허락범위 제한 없음","redistributable":"Y","asOf":"2026-09-20"},{"id":"molit-busstop","label":"국토교통부 전국 버스정류장 위치정보","publisher":"국토교통부","url":"https://www.data.go.kr/data/15067528/fileData.do","license":"이용허락범위 제한 없음","redistributable":"Y","asOf":"2025-10-31"},{"id":"hub-arch","label":"국토교통부 건축HUB 건축인허가정보","publisher":"국토교통부","url":"https://www.data.go.kr/data/15134735/openapi.do","redistributable":"unknown","asOf":"2026-10-04"},{"id":"news-lh-transport","label":"SBS Biz 2026-09-22 \"3기 신도시 첫 입주 인천계양…다음달부터 서울 출퇴근 버스 달린다\"(LH 발표 보도)","publisher":"SBS Biz","url":"https://biz.sbs.co.kr/amp/article/20000336163","asOf":"2026-09-22","redistributable":"N"},{"id":"news-segye-kinder","label":"세계일보 2026-04-15 계양신도시 공립단설유치원 신설 보도","publisher":"세계일보","url":"https://www.segye.com/newsView/20260415514534","asOf":"2026-04-15","redistributable":"N"}],"schools":[{"id":"edu-51","name":"(가칭)계양1초","level":"초등학교","status":"신설예정","openYm":"2029-03","classes":44,"students":1113,"address":"인천광역시 계양구 동양동 416-2 일원","lon":126.75732,"lat":37.555379,"sources":["edu-newschool","vworld-upis"],"poly":[[126.757775,37.555792],[126.758,37.55468],[126.756748,37.55452],[126.756571,37.555398],[126.756523,37.555632]],"areaM2":14000.0},{"id":"edu-49","name":"(가칭)계양학교","level":"특수학교","status":"신설예정","openYm":"2029-03","classes":42,"students":247,"address":"인천광역시 계양구 박촌동 175-2 일원","lon":126.751491,"lat":37.554854,"sources":["edu-newschool"]},{"id":"edu-53","name":"(가칭)계양3초","level":"초등학교","status":"신설예정","openYm":"2029-09","classes":40,"students":945,"address":"인천광역시 계양구 박촌동 249-4 일원","lon":126.756393,"lat":37.54759,"sources":["edu-newschool","vworld-upis"],"poly":[[126.757109,37.548457],[126.757361,37.547211],[126.756244,37.547068],[126.755992,37.548313]],"areaM2":14000.0},{"id":"site-elem-1","name":"초등학교 부지","level":"초등학교","status":"부지만","areaM2":14000.0,"lon":126.751019,"lat":37.550409,"poly":[[126.751452,37.551103],[126.751669,37.550027],[126.751704,37.549858],[126.750586,37.549715],[126.750334,37.55096]],"note":"학교 부지는 있으나 개교 일정은 공시되지 않음","sources":["vworld-upis"]},{"id":"site-elem-2","name":"초등학교 부지","level":"초등학교","status":"부지만","areaM2":14000.0,"lon":126.762819,"lat":37.55581,"poly":[[126.763452,37.556389],[126.763602,37.55565],[126.763562,37.555558],[126.763473,37.555445],[126.763446,37.555378],[126.762211,37.55522],[126.762197,37.555291],[126.762022,37.556154],[126.762075,37.556213]],"note":"학교 부지는 있으나 개교 일정은 공시되지 않음","sources":["vworld-upis"]},{"id":"site-mid-1","name":"중학교 부지","level":"중학교","status":"부지만","areaM2":15000.0,"lon":126.75552,"lat":37.547614,"poly":[[126.755992,37.548313],[126.756244,37.547068],[126.756035,37.547041],[126.755047,37.546915],[126.754795,37.54816]],"note":"학교 부지는 있으나 개교 일정은 공시되지 않음","sources":["vworld-upis"]},{"id":"site-mid-2","name":"중학교 부지","level":"중학교","status":"부지만","areaM2":15000.0,"lon":126.758557,"lat":37.555322,"poly":[[126.759115,37.555964],[126.75934,37.554852],[126.758,37.55468],[126.757775,37.555792]],"note":"학교 부지는 있으나 개교 일정은 공시되지 않음","sources":["vworld-upis"]},{"id":"site-high-1","name":"고등학교 부지","level":"고등학교","status":"부지만","areaM2":16000.0,"lon":126.754,"lat":37.547345,"poly":[[126.754469,37.548013],[126.754704,37.546852],[126.754723,37.54674],[126.753557,37.546591],[126.753279,37.547965],[126.753798,37.548032],[126.753971,37.548027],[126.754359,37.548077]],"note":"학교 부지는 있으나 개교 일정은 공시되지 않음","sources":["vworld-upis"]},{"id":"site-kg-1","name":"유치원 부지","level":"유치원","status":"부지만","areaM2":6000.0,"lon":126.755558,"lat":37.546693,"poly":[[126.756035,37.547041],[126.756148,37.546481],[126.755049,37.54634],[126.755055,37.54646],[126.755054,37.546581],[126.755046,37.546701],[126.75503,37.546821],[126.754919,37.546807],[126.754905,37.546878],[126.754902,37.546896]],"note":"학교 부지는 있으나 개교 일정은 공시되지 않음","sources":["vworld-upis"]},{"id":"site-kg-2","name":"유치원 부지","level":"유치원","status":"부지만","areaM2":6000.0,"lon":126.756313,"lat":37.554857,"poly":[[126.756571,37.555398],[126.756748,37.55452],[126.755801,37.554399],[126.755891,37.554602],[126.755932,37.554699],[126.755972,37.554797],[126.755863,37.554823],[126.755896,37.55491],[126.756004,37.554884],[126.756057,37.555036],[126.756105,37.555189],[126.756146,37.555343]],"note":"학교 부지는 있으나 개교 일정은 공시되지 않음","sources":["vworld-upis"]}],"zones":[{"id":"Z000101279","name":"인천당산초통학구역","school":"인천당산초등학교","schoolLon":126.759329,"schoolLat":37.558598,"poly":[[126.755262,37.567261],[126.763252,37.56583],[126.763285,37.56573],[126.76784,37.564873],[126.76852,37.565925],[126.769052,37.566298],[126.776122,37.564421],[126.776587,37.564297],[126.776837,37.564029],[126.777101,37.563719],[126.77697,37.563696],[126.776905,37.563562],[126.776842,37.563482],[126.776743,37.563241],[126.776719,37.563079],[126.77673,37.562769],[126.776691,37.562639],[126.776608,37.562615],[126.776632,37.562374],[126.776722,37.562358],[126.776914,37.56227],[126.776948,37.56223],[126.776982,37.562289],[126.777509,37.562282],[126.77754,37.561686],[126.777614,37.561311],[126.777702,37.560948],[126.777833,37.560776],[126.77793,37.560287],[126.777936,37.560155],[126.777912,37.560061],[126.777842,37.559933],[126.777787,37.559962],[126.777682,37.560112],[126.777605,37.560178],[126.777393,37.560279],[126.777348,37.560316],[126.777229,37.560617],[126.777181,37.560703],[126.777089,37.560804],[126.776865,37.561012],[126.776668,37.561214],[126.776315,37.561611],[126.776109,37.561864],[126.775886,37.56177],[126.775758,37.561941],[126.775635,37.561898],[126.775535,37.561828],[126.77549,37.5615],[126.775459,37.561433],[126.775175,37.561353],[126.775109,37.561378],[126.775041,37.561344],[126.774727,37.561348],[126.774679,37.561319],[126.774842,37.561208],[126.774878,37.561119],[126.774947,37.56104],[126.774933,37.560902],[126.774885,37.560844],[126.774663,37.560704],[126.774782,37.560541],[126.774808,37.560457],[126.774684,37.560447],[126.77455,37.560409],[126.774448,37.560436],[126.774165,37.560159],[126.77425,37.560057],[126.774242,37.559924],[126.774289,37.559756],[126.774187,37.559695],[126.773786,37.559997],[126.773591,37.560057],[126.773601,37.560007],[126.773503,37.559817],[126.773497,37.559765],[126.77336,37.559572],[126.773283,37.559503],[126.773192,37.559286],[126.772894,37.559378],[126.772742,37.559409],[126.772532,37.559008],[126.772571,37.55898],[126.772544,37.558893],[126.772446,37.558723],[126.772203,37.558627],[126.772132,37.558622],[126.771817,37.558649],[126.771822,37.5586],[126.772179,37.558324],[126.772889,37.557803],[126.773184,37.557528],[126.773092,37.557443],[126.772778,37.557279],[126.772473,37.55704],[126.772381,37.556985],[126.771994,37.556965],[126.771501,37.557075],[126.771192,37.557165],[126.770699,37.557209],[126.770349,37.557224],[126.770063,37.557211],[126.769961,37.557237],[126.769867,37.55723],[126.769533,37.557158],[126.769148,37.557134],[126.768995,37.557096],[126.768735,37.556817],[126.768272,37.556723],[126.768018,37.556725],[126.767736,37.556703],[126.7675,37.556641],[126.76735,37.556619],[126.767186,37.55665],[126.766907,37.556796],[126.766619,37.556974],[126.766284,37.556917],[126.766275,37.556851],[126.766401,37.556741],[126.766663,37.556584],[126.766752,37.556504],[126.766724,37.556316],[126.766622,37.556258],[126.766232,37.556195],[126.766009,37.556134],[126.765893,37.556077],[126.765051,37.555618],[126.764559,37.555444],[126.764484,37.55537],[126.764495,37.555275],[126.764593,37.555178],[126.764784,37.555075],[126.765059,37.555016],[126.765393,37.554987],[126.766048,37.554994],[126.766169,37.554966],[126.766336,37.554871],[126.766396,37.554792],[126.766402,37.554656],[126.766279,37.554312],[126.766203,37.554242],[126.765825,37.554104],[126.765682,37.554014],[126.765662,37.55393],[126.765693,37.553848],[126.765833,37.553728],[126.76608,37.553599],[126.766409,37.553462],[126.766962,37.55335],[126.766515,37.552753],[126.765323,37.551022],[126.763688,37.547115],[126.763646,37.546686],[126.763402,37.54675],[126.763306,37.546859],[126.763237,37.546879],[126.756743,37.548713],[126.758301,37.552486],[126.75293,37.554061],[126.752512,37.554435],[126.752009,37.555048],[126.751162,37.555447],[126.749554,37.55624],[126.748631,37.556669],[126.749118,37.557663],[126.748521,37.557997],[126.748498,37.558105],[126.746056,37.561619],[126.745147,37.562545],[126.745769,37.56225],[126.746604,37.562302],[126.746974,37.5624],[126.747727,37.562642],[126.747696,37.563367],[126.747737,37.563722],[126.748066,37.564381],[126.749315,37.563823],[126.7504,37.562753],[126.751566,37.563272],[126.752289,37.563637],[126.752586,37.564127],[126.753653,37.564303],[126.754046,37.565299],[126.754123,37.565454],[126.754235,37.565566],[126.754417,37.56569],[126.754601,37.565728],[126.754526,37.56592],[126.754452,37.565983],[126.754563,37.565994],[126.754858,37.565996],[126.755688,37.566138],[126.755891,37.566166],[126.75603,37.566207],[126.756155,37.56632],[126.756242,37.566473],[126.756235,37.566574],[126.756298,37.566658],[126.755349,37.567137],[126.755166,37.567258]],"asOf":"2026-09-20","sources":["edu-zone"]},{"id":"Z000101299","name":"인천소양초통학구역","school":"인천소양초등학교","schoolLon":126.74239,"schoolLat":37.555972,"poly":[[126.746056,37.561619],[126.748498,37.558105],[126.748521,37.557997],[126.749118,37.557663],[126.748631,37.556669],[126.748937,37.556526],[126.749554,37.55624],[126.751162,37.555447],[126.752009,37.555048],[126.752512,37.554435],[126.75293,37.554061],[126.758301,37.552486],[126.756743,37.548713],[126.763237,37.546879],[126.763306,37.546859],[126.763355,37.54680